{
  "spdxVersion": "SPDX-2.3",
  "dataLicense": "CC0-1.0",
  "SPDXID": "SPDXRef-DOCUMENT",
  "name": "design-dna-13.6.1-98b140773d1f",
  "documentNamespace": "urn:uuid:76ca5323-60ce-5201-a272-015871b69d38",
  "creationInfo": {
    "created": "2026-11-01T09:30:08.016184Z",
    "creators": [
      "Tool: design-dna-build-sbom-1.0.0",
      "Person: Motty"
    ],
    "licenseListVersion": "3.27"
  },
  "documentDescribes": [
    "SPDXRef-Package-design-dna"
  ],
  "packages": [
    {
      "SPDXID": "SPDXRef-Package-design-dna",
      "name": "design-dna",
      "versionInfo": "13.6.1",
      "downloadLocation": "NOASSERTION",
      "filesAnalyzed": false,
      "licenseConcluded": "LicenseRef-DesignDNA-Proprietary",
      "licenseDeclared": "LicenseRef-DesignDNA-Proprietary",
      "copyrightText": "Copyright (c) 2026 Motty. All rights reserved.",
      "primaryPackagePurpose": "LIBRARY",
      "supplier": "Person: Motty",
      "sourceInfo": "Runtime tree canonical content SHA-256: 98b140773d1f264973cd7fab22bd8bfebad1f6c738cf696f1296ac0d9d39e9c3. Maintainer dependencies are inventory only and are not bundled in the runtime skill. Python artifacts are SHA-256 locked; npm artifacts are integrity-locked by package-lock.json.",
      "externalRefs": [
        {
          "referenceCategory": "PACKAGE-MANAGER",
          "referenceType": "purl",
          "referenceLocator": "pkg:generic/design-dna@13.6.1"
        }
      ]
    },
    {
      "SPDXID": "SPDXRef-Package-pypi-attrs-26.1.0-cc0e52102583",
      "name": "attrs",
      "versionInfo": "26.1.0",
      "downloadLocation": "NOASSERTION",
      "filesAnalyzed": false,
      "licenseConcluded": "NOASSERTION",
      "licenseDeclared": "NOASSERTION",
      "copyrightText": "NOASSERTION",
      "externalRefs": [
        {
          "referenceCategory": "PACKAGE-MANAGER",
          "referenceType": "purl",
          "referenceLocator": "pkg:pypi/attrs@26.1.0"
        }
      ],
      "primaryPackagePurpose": "LIBRARY",
      "supplier": "NOASSERTION",
      "checksums": [
        {
          "algorithm": "SHA256",
          "checksumValue": "c647aa4a12dfbad9333ca4e71fe62ddc36f4e63b2d260a37a8b83d2f043ac309"
        },
        {
          "algorithm": "SHA256",
          "checksumValue": "d03ceb89cb322a8fd706d4fb91940737b6642aa36998fe130a9bc96c985eff32"
        }
      ]
    },
    {
      "SPDXID": "SPDXRef-Package-pypi-jsonschema-4.25.1-fcd248e681c7",
      "name": "jsonschema",
      "versionInfo": "4.25.1",
      "downloadLocation": "NOASSERTION",
      "filesAnalyzed": false,
      "licenseConcluded": "NOASSERTION",
      "licenseDeclared": "NOASSERTION",
      "copyrightText": "NOASSERTION",
      "externalRefs": [
        {
          "referenceCategory": "PACKAGE-MANAGER",
          "referenceType": "purl",
          "referenceLocator": "pkg:pypi/jsonschema@4.25.1"
        }
      ],
      "primaryPackagePurpose": "LIBRARY",
      "supplier": "NOASSERTION",
      "checksums": [
        {
          "algorithm": "SHA256",
          "checksumValue": "3fba0169e345c7175110351d456342c364814cfcf3b964ba4587f22915230a63"
        },
        {
          "algorithm": "SHA256",
          "checksumValue": "e4a9655ce0da0c0b67a085847e00a3a51449e1157f4f75e9fb5aa545e122eb85"
        }
      ]
    },
    {
      "SPDXID": "SPDXRef-Package-pypi-jsonschema-specifications-2025.9.1-32fbfa397422",
      "name": "jsonschema-specifications",
      "versionInfo": "2025.9.1",
      "downloadLocation": "NOASSERTION",
      "filesAnalyzed": false,
      "licenseConcluded": "NOASSERTION",
      "licenseDeclared": "NOASSERTION",
      "copyrightText": "NOASSERTION",
      "externalRefs": [
        {
          "referenceCategory": "PACKAGE-MANAGER",
          "referenceType": "purl",
          "referenceLocator": "pkg:pypi/jsonschema-specifications@2025.9.1"
        }
      ],
      "primaryPackagePurpose": "LIBRARY",
      "supplier": "NOASSERTION",
      "checksums": [
        {
          "algorithm": "SHA256",
          "checksumValue": "98802fee3a11ee76ecaca44429fda8a41bff98b00a0f2838151b113f210cc6fe"
        },
        {
          "algorithm": "SHA256",
          "checksumValue": "b540987f239e745613c7a9176f3edb72b832a4ac465cf02712288397832b5e8d"
        }
      ]
    },
    {
      "SPDXID": "SPDXRef-Package-pypi-packaging-26.2-617c53663c57",
      "name": "packaging",
      "versionInfo": "26.2",
      "downloadLocation": "NOASSERTION",
      "filesAnalyzed": false,
      "licenseConcluded": "NOASSERTION",
      "licenseDeclared": "NOASSERTION",
      "copyrightText": "NOASSERTION",
      "externalRefs": [
        {
          "referenceCategory": "PACKAGE-MANAGER",
          "referenceType": "purl",
          "referenceLocator": "pkg:pypi/packaging@26.2"
        }
      ],
      "primaryPackagePurpose": "LIBRARY",
      "supplier": "NOASSERTION",
      "checksums": [
        {
          "algorithm": "SHA256",
          "checksumValue": "5fc45236b9446107ff2415ce77c807cee2862cb6fac22b8a73826d0693b0980e"
        },
        {
          "algorithm": "SHA256",
          "checksumValue": "ff452ff5a3e828ce110190feff1178bb1f2ea2281fa2075aadb987c2fb221661"
        }
      ]
    },
    {
      "SPDXID": "SPDXRef-Package-pypi-pyyaml-6.0.2-309c3f2931e8",
      "name": "pyyaml",
      "versionInfo": "6.0.2",
      "downloadLocation": "NOASSERTION",
      "filesAnalyzed": false,
      "licenseConcluded": "NOASSERTION",
      "licenseDeclared": "NOASSERTION",
      "copyrightText": "NOASSERTION",
      "externalRefs": [
        {
          "referenceCategory": "PACKAGE-MANAGER",
          "referenceType": "purl",
          "referenceLocator": "pkg:pypi/pyyaml@6.0.2"
        }
      ],
      "primaryPackagePurpose": "LIBRARY",
      "supplier": "NOASSERTION",
      "checksums": [
        {
          "algorithm": "SHA256",
          "checksumValue": "01179a4a8559ab5de078078f37e5c1a30d76bb88519906844fd7bdea1b7729ff"
        },
        {
          "algorithm": "SHA256",
          "checksumValue": "0833f8694549e586547b576dcfaba4a6b55b9e96098b36cdc7ebefe667dfed48"
        },
        {
          "algorithm": "SHA256",
          "checksumValue": "0a9a2848a5b7feac301353437eb7d5957887edbf81d56e903999a75a3d743086"
        },
        {
          "algorithm": "SHA256",
          "checksumValue": "0b69e4ce7a131fe56b7e4d770c67429700908fc0752af059838b1cfb41960e4e"
        },
        {
          "algorithm": "SHA256",
          "checksumValue": "0ffe8360bab4910ef1b9e87fb812d8bc0a308b0d0eef8c8f44e0254ab3b07133"
        },
        {
          "algorithm": "SHA256",
          "checksumValue": "11d8f3dd2b9c1207dcaf2ee0bbbfd5991f571186ec9cc78427ba5bd32afae4b5"
        },
        {
          "algorithm": "SHA256",
          "checksumValue": "17e311b6c678207928d649faa7cb0d7b4c26a0ba73d41e99c4fff6b6c3276484"
        },
        {
          "algorithm": "SHA256",
          "checksumValue": "1e2120ef853f59c7419231f3bf4e7021f1b936f6ebd222406c3b60212205d2ee"
        },
        {
          "algorithm": "SHA256",
          "checksumValue": "1f71ea527786de97d1a0cc0eacd1defc0985dcf6b3f17bb77dcfc8c34bec4dc5"
        },
        {
          "algorithm": "SHA256",
          "checksumValue": "23502f431948090f597378482b4812b0caae32c22213aecf3b55325e049a6c68"
        },
        {
          "algorithm": "SHA256",
          "checksumValue": "24471b829b3bf607e04e88d79542a9d48bb037c2267d7927a874e6c205ca7e9a"
        },
        {
          "algorithm": "SHA256",
          "checksumValue": "29717114e51c84ddfba879543fb232a6ed60086602313ca38cce623c1d62cfbf"
        },
        {
          "algorithm": "SHA256",
          "checksumValue": "2e99c6826ffa974fe6e27cdb5ed0021786b03fc98e5ee3c5bfe1fd5015f42b99"
        },
        {
          "algorithm": "SHA256",
          "checksumValue": "39693e1f8320ae4f43943590b49779ffb98acb81f788220ea932a6b6c51004d8"
        },
        {
          "algorithm": "SHA256",
          "checksumValue": "3ad2a3decf9aaba3d29c8f537ac4b243e36bef957511b4766cb0057d32b0be85"
        },
        {
          "algorithm": "SHA256",
          "checksumValue": "3b1fdb9dc17f5a7677423d508ab4f243a726dea51fa5e70992e59a7411c89d19"
        },
        {
          "algorithm": "SHA256",
          "checksumValue": "41e4e3953a79407c794916fa277a82531dd93aad34e29c2a514c2c0c5fe971cc"
        },
        {
          "algorithm": "SHA256",
          "checksumValue": "43fa96a3ca0d6b1812e01ced1044a003533c47f6ee8aca31724f78e93ccc089a"
        },
        {
          "algorithm": "SHA256",
          "checksumValue": "50187695423ffe49e2deacb8cd10510bc361faac997de9efef88badc3bb9e2d1"
        },
        {
          "algorithm": "SHA256",
          "checksumValue": "5ac9328ec4831237bec75defaf839f7d4564be1e6b25ac710bd1a96321cc8317"
        },
        {
          "algorithm": "SHA256",
          "checksumValue": "5d225db5a45f21e78dd9358e58a98702a0302f2659a3c6cd320564b75b86f47c"
        },
        {
          "algorithm": "SHA256",
          "checksumValue": "6395c297d42274772abc367baaa79683958044e5d3835486c16da75d2a694631"
        },
        {
          "algorithm": "SHA256",
          "checksumValue": "688ba32a1cffef67fd2e9398a2efebaea461578b0923624778664cc1c914db5d"
        },
        {
          "algorithm": "SHA256",
          "checksumValue": "68ccc6023a3400877818152ad9a1033e3db8625d899c72eacb5a668902e4d652"
        },
        {
          "algorithm": "SHA256",
          "checksumValue": "70b189594dbe54f75ab3a1acec5f1e3faa7e8cf2f1e08d9b561cb41b845f69d5"
        },
        {
          "algorithm": "SHA256",
          "checksumValue": "797b4f722ffa07cc8d62053e4cff1486fa6dc094105d13fea7b1de7d8bf71c9e"
        },
        {
          "algorithm": "SHA256",
          "checksumValue": "7c36280e6fb8385e520936c3cb3b8042851904eba0e58d277dca80a5cfed590b"
        },
        {
          "algorithm": "SHA256",
          "checksumValue": "7e7401d0de89a9a855c839bc697c079a4af81cf878373abd7dc625847d25cbd8"
        },
        {
          "algorithm": "SHA256",